{
  "$schema": "https://json-schema.org/draft/2020-12/schema",
  "$id": "pharos-agent-escrow/proof.schema.json",
  "title": "Pharos Agent Escrow Proof Metadata",
  "type": "object",
  "additionalProperties": true,
  "required": [
    "schema",
    "workOrderId",
    "workerAgent",
    "summary",
    "submittedAt"
  ],
  "anyOf": [
    { "required": ["resultURI"] },
    { "required": ["deliveredArtifact"] }
  ],
  "properties": {
    "schema": {
      "const": "pharos-agent-escrow/proof/v1"
    },
    "workOrderId": {
      "type": "string",
      "minLength": 1
    },
    "workerAgent": {
      "type": "string",
      "minLength": 1
    },
    "resultURI": {
      "type": "string",
      "pattern": "^(ipfs://|https://|http://|file://|sha256:).+"
    },
    "deliveredArtifact": {
      "type": "string",
      "minLength": 1
    },
    "resultSha256": {
      "type": "string",
      "pattern": "^[0-9a-fA-F]{64}$"
    },
    "summary": {
      "type": "string",
      "minLength": 1
    },
    "criteriaResults": {
      "type": "array",
      "minItems": 1,
      "items": {
        "type": "object",
        "additionalProperties": true,
        "required": ["criterion", "evidence", "passed"],
        "properties": {
          "criterion": {
            "type": "string",
            "minLength": 1
          },
          "evidence": {
            "type": "string",
            "minLength": 1
          },
          "passed": {
            "type": "boolean"
          }
        }
      }
    },
    "verificationNotes": {
      "oneOf": [
        {
          "type": "array",
          "minItems": 1,
          "items": {
            "type": "string",
            "minLength": 1
          }
        },
        {
          "type": "string",
          "minLength": 1
        }
      ]
    },
    "submittedAt": {
      "type": "string",
      "pattern": "^\\d{4}-\\d{2}-\\d{2}T\\d{2}:\\d{2}:\\d{2}Z$"
    }
  }
}
